{
  "$schema": "https://json-schema.org/draft/2020-12/schema",
  "$id": "https://english-kb/schema-personal-enhancement.json",

  "title": "Personal Knowledge Enhancement",

  "type": "object",

  "required": [
    "id",
    "knowledgePointId",
    "targetType",
    "enhancementType",
    "content",
    "createdAt"
  ],

  "properties": {

    "id": {
      "type": "string",
      "pattern": "^enhancement_"
    },

    "knowledgePointId": {
      "type": "string",
      "pattern": "^eng_"
    },

    "targetType": {
      "type": "string",
      "enum": [
        "KNOWLEDGE_POINT",
        "DEFINITION",
        "EXAMPLE",
        "EXPRESSION",
        "CLASSIFICATION",
        "COMPARISON",
        "ASSOCIATION",
        "SCENARIO",
        "COUNTER_EXAMPLE",
        "CONFUSION",
        "MNEMONIC",
        "EXTENSION"
      ]
    },

    "targetId": {
      "type": [
        "string",
        "null"
      ]
    },

    "enhancementType": {
      "type": "string",
      "enum": [
        "BETTER_EXPLANATION",
        "BETTER_EXAMPLE",
        "ALTERNATIVE_VIEW",
        "TEACHER_NOTE",
        "BOOK_NOTE",
        "AI_NOTE",
        "PERSONAL_UNDERSTANDING",
        "MEMORY_METHOD",
        "VISUALIZATION",
        "MIND_MAP",
        "REFERENCE"
      ]
    },

    "title": {
      "type": "string"
    },

    "content": {
      "type": "array",
      "items": {
        "type": "string"
      }
    },

    "attachments": {
      "type": "array",
      "items": {
        "type": "string"
      }
    },

    "source": {
      "type": [
        "string",
        "null"
      ]
    },

    "tags": {
      "type": "array",
      "items": {
        "type": "string"
      }
    },

    "confidence": {
      "type": [
        "number",
        "null"
      ],
      "minimum": 0,
      "maximum": 1
    },

    "createdAt": {
      "type": "string",
      "format": "date-time"
    }
  }
}