{
  "id": "enhancement_eng_vocabulary_word_endings_rry_ry_b1_example_bundle_009",
  "knowledgePointId": "eng_vocabulary_word_endings_rry_ry_b1",
  "targetType": "EXAMPLE",
  "targetId": null,
  "enhancementType": "BETTER_EXAMPLE",
  "title": "中学生B1例句强化包：-rry 与 -ry",
  "content": [
    "课堂速记场景：The teacher said, 'Do not hurry your writing; check each summary sentence first.' 学习价值：同句对比 hurry（-rry）与 summary（-ry），训练考试写作时的拼写自检。",
    "图书馆任务场景：After history class, we carried our project board to the library and wrote a short theory note. 学习价值：carried（来自 carry, -rry）和 history/library/theory（-ry）在同一任务流程中出现，便于区分动作词与学术名词。",
    "口语道歉场景：Sorry, I was in a hurry, so I copied the date from memory and made a spelling mistake. 学习价值：先用高频口语 sorry/hurry（-rry），再过渡到 memory（-ry），适合真实校园沟通。",
    "小组展示场景：Our group summary includes one berry experiment and one memory test. 学习价值：berry（-rry）与 memory（-ry）放在同一展示句里，帮助学生在学科汇报中稳定识别后缀。",
    "自我纠错场景：Wrong: The libarry summarry was hard to read. Correct: The library summary was hard to read. 学习价值：通过一错一对的例句，直接打击常见误写，提升B1阶段书面准确率。"
  ],
  "source": null,
  "tags": [
    "B1",
    "中学生",
    "EXAMPLE",
    "rry",
    "ry",
    "spelling",
    "school"
  ],
  "confidence": 0.96,
  "createdAt": "2026-08-07T00:00:00+09:00"
}
